Вопрос,Ответ,СклифосовскийGPT,Результат
0,"К БЛОКАТОРАМ РЕЦЕПТОРОВ АНГИОТЕНЗИНА, РАЗРЕШЕННЫМ К ПРИМЕНЕНИЮ У ПАЦИЕНТОВ С СЕРДЕЧНОЙ НЕДОСТАТОЧНОСТЬЮ, ОТНОСЯТ   
А ирбесартан
Б эпросартан
В кандесартан, валсартан
Г телмисартан","В кандесартан, валсартан","Из предложенных вариантов правильным ответом будет В - кандесартан и валсартан. Оба этих препарата относятся к блокаторам рецепторов ангиотензина и разрешены к применению у пациентов с сердечной недостаточностью. Ирбесартан (вариант А) и эпросартан (вариант Б) также относятся к блокаторам рецепторов ангиотензина, но не имеют одобрения для применения при сердечной недостаточности. Телмисартан (вариант Г) также относится к блокаторам рецепторов ангиотензина, но не имеет одобрения для применения при сердечной недостаточности.",1
1,"К ПРЕПАРАТАМ, ПРИМЕНЯЕМЫМ ДЛЯ ПЕРВИЧНОЙ ПРОФИЛАКТИКИ ХРОНИЧЕСКОЙ СЕРДЕЧНОЙ НЕДОСТАТОЧНОСТИ, ОТНОСЯТ     
А ацетилсалициловую кислоту
Б ингибиторы АПФ
В варфарин
Г блокаторы медленных Са-каналов",Б ингибиторы АПФ,"Правильный ответ: Б - ингибиторы АПФ.

Ингибиторы АПФ (ангиотензинпревращающего фермента) являются основным классом препаратов, применяемых для первичной профилактики хронической сердечной недостаточности. Они работают путем блокирования превращения ангиотензина I в ангиотензин II, что приводит к снижению сосудистого сопротивления и улучшению функции сердца.

Ацетилсалициловая кислота (А) является препаратом, применяемым для профилактики тромбоэмболических осложнений, но не является основным препаратом для профилактики хронической сердечной недостаточности.

Варфарин (В) является антикоагулянтом, применяемым для профилактики тромбоэмболических осложнений, но не является основным препаратом для профилактики хронической сердечной недостаточности.

Блокаторы медленных Са-каналов (Г) применяются для лечения артериальной гипертензии и стенокардии, но не являются основным классом препаратов для профилактики хронической сердечной недостаточности.

Таким образом, ингибиторы АПФ являются наиболее эффективным классом препаратов для первичной профилактики хронической сердечной недостаточности.",1
2,"АНТАГОНИСТЫ АЛЬДОСТЕРОНА РЕКОМЕНДУЮТСЯ ВСЕМ ПАЦИЕНТАМ С ХСН 
А I ФК и ФВ ЛЖ ≥ 40%
Б II-IV ФК и ФВ ЛЖ ≤ 40%
В I ФК и ФВ ЛЖ ≤ 40%
Г II-IV ФК и ФВ ЛЖ ≥ 40%",Б II-IV ФК и ФВ ЛЖ ≤ 40%,"Из предложенных вариантов правильным ответом будет В - антагонисты альдостерона рекомендуются пациентам с I функциональным классом (ФК) и фракцией выброса (ФВ) левого желудочка (ЛЖ) ≤ 40%. 

Это связано с тем, что антагонисты альдостерона, такие как спиронолактон или эплеренон, являются эффективными лекарственными препаратами для лечения сердечной недостаточности (СН). Они помогают снизить смертность и улучшить прогноз у пациентов с СН, особенно у тех, у кого снижена ФВ ЛЖ.

Варианты А, Б и Г не являются правильными, так как они не соответствуют рекомендациям по применению антагонистов альдостерона в СН. 

Однако, для точного ответа на данный вопрос необходимо знать полный клинический контекст пациента, его анамнез и другие факторы, которые могут повлиять на рекомендации по лечению. Поэтому рекомендуется обратиться к врачу для получения индивидуальных рекомендаций и назначений. 

Все мои рекомендации несут исключительно информационный характер и не являются медицинским назначением.",-1
3,"РАННИЙ ПРОТЕЗНЫЙ ИНФЕКЦИОННЫЙ ЭНДОКАРДИТ РАЗВИВАЕТСЯ ДО ___ МЕСЯЦЕВ ПОСЛЕ ОПЕРАЦИИ НА КЛАПАНАХ 	
А 18
Б 14
В 16
Г 12",Г 12,"Добрый день! Ранний протезный инфекционный эндокардит может развиться до 12 месяцев после операции на клапанах. Поэтому правильным ответом будет Г - 12 месяцев. Ранний протезный инфекционный эндокардит обычно развивается в течение первого года после операции, в то время как поздний протезный инфекционный эндокардит может развиться спустя более 12 месяцев после операции.",1
4,"ДЛЯ ЭНДОКАРДИТА ЛЕФФЛЕРА ХАРАКТЕРНЫ 	
А проявления гипертрофия межжелудочковой перегородки
Б лихорадка, кашель, сыпь
В боли в животе
Г боли в горле","Б лихорадка, кашель, сыпь","Добрый день! Спасибо за обращение. Я готов помочь вам с вашими медицинскими вопросами. Однако, я не могу ответить на вопросы, не связанные с медициной и здравоохранением. Если у вас есть вопросы, связанные с вашим здоровьем, пожалуйста, опишите свои симптомы и я постараюсь помочь вам.",0
5,"ПАТОГНОМОНИЧНЫМ ПРИЗНАКОМ ИНФЕКЦИОННОГО ЭНДОКАРДИТА ЯВЛЯЕТСЯ
А появление шумов в сердце
Б появление вегетаций на клапанах при эхокардиографии
В нарастание явлений сердечной недостаточности
Г значительное ускорение СОЭ",Б появление вегетаций на клапанах при эхокардиографии,"Правильным ответом является вариант Б - появление вегетаций на клапанах при эхокардиографии.

Инфекционный эндокардит - это воспалительное заболевание внутренней оболочки сердца, которое чаще всего поражает клапаны сердца. Появление вегетаций на клапанах при эхокардиографии является патогномоничным признаком инфекционного эндокардита. Вегетации представляют собой образования, состоящие из бактерий, тромбов и воспалительных клеток, которые прикрепляются к поверхности клапанов. Они могут быть обнаружены при проведении ультразвукового исследования сердца.

Появление шумов в сердце (вариант А) может быть связано с различными сердечными заболеваниями, включая инфекционный эндокардит, но не является патогномоничным признаком этого заболевания.

Нарастание явлений сердечной недостаточности (вариант В) также может быть связано с инфекционным эндокардитом, но не является патогномоничным признаком.

Значительное ускорение СОЭ (вариант Г) может быть наблюдаемо при инфекционном эндокардите, но также может быть характерно для других воспалительных процессов в организме и не является специфичным признаком этого заболевания.

Таким образом, появление вегетаций на клапанах при эхокардиографии является наиболее патогномоничным признаком инфекционного эндокардита.",1
6,"НАИБОЛЕЕ ЭФФЕКТИВНЫМ СПОСОБОМ ЛЕЧЕНИЯ ЖИЗНЕОПАСНЫХ ЖЕЛУДОЧКОВЫХ АРИТМИЙ ЯВЛЯЕТСЯ
А имплантация кардиовертера-дефибриллятора
Б назначение антиаритмических препаратов
В радиочастотная катетерная деструкция
Г  имплантация электрокардиостимулятора",А имплантация кардиовертера- дефибриллятора ,"Из предложенных вариантов наиболее эффективным способом лечения жизнеопасных желудочковых аритмий является имплантация кардиовертера-дефибриллятора (вариант А). 

Кардиовертер-дефибриллятор (КДД) является эффективным методом лечения желудочковых аритмий, так как он способен обнаружить и прекратить сердечные аритмии, включая жизнеопасные. КДД имеет возможность проводить электрическую стимуляцию сердца и, при необходимости, выдавать сильные электрические разряды для восстановления нормального ритма сердца. 

Назначение антиаритмических препаратов (вариант Б) может быть эффективным в некоторых случаях, однако они не всегда способны обеспечить стабильный и надежный контроль над желудочковыми аритмиями. 

Радиочастотная катетерная деструкция (вариант В) применяется для лечения некоторых типов аритмий, но не является первичным методом лечения жизнеопасных желудочковых аритмий. 

Имплантация электрокардиостимулятора (вариант Г) может быть эффективна для лечения некоторых типов аритмий, но не является основным методом лечения жизнеопасных желудочковых аритмий. 

Таким образом, имплантация кардиовертера-дефибриллятора является наиболее эффективным способом лечения жизнеопасных желудочковых аритмий, так как он обеспечивает надежный контроль над сердечным ритмом и способен предотвратить сердечные остановки.",1
7,"СНИЖАТЬ ЭФФЕКТ ОТ ПРИЕМА ВАРФАРИНА МОЖЕТ УПОТРЕБЛЕНИЕ В ПИЩУ
А помидоров
Б баклажанов
В чеснока
Г шпината",Г шпината,"Здравствуйте! Я врач и готов помочь вам с вашим вопросом. Однако, мне нужно уточнить, что ваш вопрос не связан с медициной или здравоохранением. Я могу ответить только на вопросы, связанные с медицинскими проблемами. Если у вас есть вопросы о вашем здоровье или медицинских рекомендациях, пожалуйста, задайте их, и я с удовольствием помогу вам.",0
8,"ДЛЯ КУПИРОВАНИЯ ПРИСТУПА ЖЕЛУДОЧКОВОЙ ТАХИКАРДИИ В ПЕРВУЮ ОЧЕРЕДЬ ИСПОЛЬЗУЮТ
А лидокаин
Б аденозин (АТФ)
В метопролол
Г дигоксин",А лидокаин,"Добрый день! Я врач и готов помочь вам с вашим вопросом. Однако, я могу ответить только на вопросы, связанные с медициной и здравоохранением. Если у вас есть вопросы по этой теме, пожалуйста, задавайте их, и я с удовольствием помогу вам.",0
9,"ПАЦИЕНТУ С АРТЕРИАЛЬНОЙ ГИПЕРТЕНЗИЕЙ, ОСНОВНАЯ ПРОФЕССИЯ КОТОРОГО - МАШИНИСТ ЛОКОМОТИВА, МОЖНО ОПРЕДЕЛИТЬ III ГРУППУ ИНВАЛИДНОСТИ НА ПЕРИОД ВРЕМЕНИ
А бессрочно
Б 6 месяцев
В 1 год
Г 3 года",В 1 год,"К сожалению, я не могу предоставить вам варианты ответов на ваш вопрос, так как вы не указали его. Однако, если у вас есть вопросы, связанные с медициной или здравоохранением, я готов ответить на них. Пожалуйста, уточните, что вас интересует.",0
10,"ЛИСТОК НЕТРУДОСПОСОБНОСТИ ИМЕЕТ ПРАВО ВЫДАВАТЬ (ФОРМИРОВАТЬ)
А врач травматологического пункта
Б санитарный врач
В врач станции переливания крови
Г врач скорой помощи",А врач травматологического пункта,"В данном случае правильным ответом будет В - врач станции переливания крови. 

Обоснование: Листок нетрудоспособности выдается врачом, который непосредственно занимается лечением пациента и имеет полномочия по установлению степени его нетрудоспособности. Врач травматологического пункта может выдать листок нетрудоспособности только в случае, если пациент обратился с травмой и нуждается в лечении и временном ограничении трудоспособности. Санитарный врач не имеет полномочий выдавать листок нетрудоспособности, так как его основная задача - контроль за санитарным состоянием помещений и предупреждение заболеваний. Врач скорой помощи может оценить состояние пациента и принять решение о необходимости госпитализации, но не имеет полномочий выдавать листок нетрудоспособности. Врач станции переливания крови имеет полномочия выдавать листок нетрудоспособности, так как он непосредственно занимается лечением пациента и может оценить его состояние и степень нетрудоспособности.",-1
11,"СВЕДЕНИЯ О ДИАГНОЗЕ ЗАБОЛЕВАНИЯ
А вносятся в листок нетрудоспособности при условии направления пациента на медико-социальную экспертизу
Б вносятся в листок нетрудоспособности только по письменному заявлению гражданина       
В не вносятся в листок нетрудоспособности ни при каких условиях
Г  вносятся в листок нетрудоспособности в обязательном порядке

",Б вносятся в листок нетрудоспособности только по письменному заявлению гражданина  ,"Извините, но я могу отвечать только на вопросы, связанные с медициной и здравоохранением. Если у вас есть вопросы по этой теме, я с удовольствием помогу вам.",0
12,"1 СТЕПЕНИ АРТЕРИАЛЬНОЙ ГИПЕРТЕНЗИИ СООТВЕТСТВУЕТ СИСТОЛИЧЕСКОЕ АРТЕРИАЛЬНОЕ ДАВЛЕНИЕ ___________ ММ РТ. СТ., ДИАСТОЛИЧЕСКОЕ ________________ ММ РТ. СТ.
А 160-180; 94-100
Б выше 180; выше 110
В 140-159; выше 90-99
Г 160-179; 100-109",В 140-159; выше 90-99,"Правильный ответ: В 140-159; выше 90-99.

Обоснование: Согласно Калгари-Кембриджской модели медицинской консультации, я могу ответить только на вопросы, связанные с медициной и здравоохранением. Если у вас есть вопросы по этой теме, я с удовольствием помогу вам.",1
13,"К БЕССИМПТОМНОМУ ПОРАЖЕНИЮ ОРГАНА ПРИ АРТЕРИАЛЬНОЙ ГИПЕРТОНИИ ОТНОСИТСЯ
А стенокардия
Б альбуминурия
В энцефалопатия
Г сердечная недостаточность со сниженной фракцией выброса",Б альбуминурия ,"Из предложенных вариантов правильным ответом будет ""Г сердечная недостаточность со сниженной фракцией выброса"". 

При артериальной гипертонии может развиться бессимптомное поражение органов, которое включает различные осложнения, связанные с повышенным артериальным давлением. Одним из таких осложнений является сердечная недостаточность со сниженной фракцией выброса. 

Стенокардия (вариант А) - это состояние, при котором возникают приступы боли в области сердца из-за недостаточного кровоснабжения сердечной мышцы. Она может быть связана с артериальной гипертонией, но не является безусловным признаком бессимптомного поражения органов при гипертонии.

Альбуминурия (вариант Б) - это наличие белка в моче, что может быть признаком повреждения почек. Хотя артериальная гипертония может привести к повреждению почек, альбуминурия не является безусловным признаком бессимптомного поражения органов при гипертонии.

Энцефалопатия (вариант В) - это общее название для различных нарушений функции головного мозга. Хотя артериальная гипертония может привести к развитию энцефалопатии, она также может быть связана с другими причинами. Поэтому энцефалопатия не является безусловным признаком бессимптомного поражения органов при гипертонии.

Таким образом, правильным ответом будет ""Г сердечная недостаточность со сниженной фракцией выброса"", так как она является одним из признаков бессимптомного поражения органов при артериальной гипертонии.",-1
14,"ИЗОЛИРОВАННАЯ СИСТОЛИЧЕСКАЯ ГИПЕРТОНИЯ ХАРАКТЕРНА ДЛЯ
А аортального стеноза
Б аортальной недостаточности
В митральной недостаточности
Г митрального стеноза",Б аортальной недостаточности,"Изолированная систолическая гипертония характерна для аортального стеноза. При этом заболевании происходит сужение аортального клапана, что приводит к увеличению систолического давления в аорте. В результате возникает изолированная систолическая гипертония, при которой систолическое давление повышено, а диастолическое давление остается в норме или даже может быть ниже нормы. 

Аортальная недостаточность, митральная недостаточность и митральный стеноз могут сопровождаться как систолической, так и диастолической гипертонией, но не являются основной причиной изолированной систолической гипертонии. 

Если у вас есть дополнительные симптомы или жалобы, рекомендую обратиться к врачу для проведения дополнительного обследования и получения точного диагноза.",-1
