Вопрос,Ответ,YaGPT-3 PRO,Результат
40,"ЭЛЕКТРОКАРДИОГРАФИЧЕСКИМ ПРОЯВЛЕНИЕМ, ХАРАКТЕРНЫМ ДЛЯ АВ БЛОКАДЫ III СТЕПЕНИ, ЯВЛЯЕТСЯ
А постепенное удлинение интервала PQ перед выпадением одного или нескольких комплексов QRS
Б полная разобщённость предсердных и желудочковых комплексов
В независимая эктопическая электрическая активность левого предсердия на фоне синусового ритма
Г периодическое выпадение одного или нескольких комплексов QRS при постоянном интервале PQ",Б полная разобщённость предсердных и желудочковых комплексов,"Правильный ответ - Б. Полная разобщенность предсердных и желудочковых комплексов. Это связано с тем, что при АВ блокаде III степени полностью прекращается проведение импульсов от предсердий к желудочкам. Предсердия сокращаются под влиянием синусового узла, а желудочки - в собственном ритме, который обычно ниже 40 ударов в минуту, что недостаточно для обеспечения адекватного кровообращения.",1
41,"ЧРЕСПИЩЕВОДНУЮ ЭХОКАРДИОГРАФИЮ СЛЕДУЕТ ПРОВОДИТЬ ПРИ ПАРОКСИЗМАЛЬНОЙ ФОРМЕ ФИБРИЛЛЯЦИИ ПРЕДСЕРДИЙ ДЛЯ ИСКЛЮЧЕНИЯ
А внутрисердечного тромбоза
Б дилятации левого предсердия
В аневризмы левого желудочка
Г тромбоза ветвей лёгочной артерии",А внутрисердечного тромбоза ,"А. Внутрисердечный тромбоз
Обоснование: Чреспищеводная эхокардиография (ЧП ЭХО) является высокочувствительным методом выявления тромбов в левом предсердии (ЛП), что делает её критически важной для исключения внутрисердечного тромбоза у пациентов с пароксизмальной формой фибрилляции предсердий (ФП). Это связано с повышенным риском тромбообразования при ФП, особенно при длительном существовании аритмии.",1
42,"ИЗМЕНЕНИЯМИ НА ЭКГ, ХАРАКТЕРНЫМИ ДЛЯ НАДЖЕЛУДОЧКОВОЙ ТАХИКАРДИИ С УЧАСТИЕМ ДОПОЛНИТЕЛЬНЫХ ПУТЕЙ ПРОВЕДЕНИЯ, ЯВЛЯЮТСЯ НОРМАЛЬНОЙ ШИРИНЫ QRS-КОМПЛЕКСЫ И
А зубцы Р в области сегмента ST или зубца Т
Б отсутствие зубца Р
В АВ-блокада 2-степени
Г зубцы Р (отличающимися от синусовых) перед QRS-комплексами",А зубцы Р в области сегмента ST или зубца Т,"Правильный ответ – Г.
Для наджелудочковой тахикардии с участием дополнительных путей проведения характерны зубцы Р (отличающиеся от синусовых) перед QRS-комплексами. Это связано с тем, что дополнительные пути проведения позволяют импульсу обходить АВ-узел и быстрее достигать желудочков, что приводит к преждевременному возбуждению желудочков и появлению зубцов Р перед QRS-комплексами.",-1
43,"ДЛЯ ИНФАРКТА МИОКАРДА НЕ ЯВЛЯЕТСЯ ХАРАКТЕРНЫМ
А наличие гипотонии
Б ритм галопа
В ритм перепела
Г наличие аритмии",В ритм перепела ,"Правильный ответ - А, наличие гипотонии. Гипотония, то есть пониженное артериальное давление, не является характерным признаком инфаркта миокарда. Напротив, в момент инфаркта часто наблюдается повышение артериального давления как реакция организма на стресс и повреждение сердечной мышцы. Характерными признаками инфаркта являются острая непроходящая боль в середине грудной клетки, холодный липкий пот, бледность кожи, одышка, постоянное чувство страха смерти, несвойственная больному тревожность, иногда - паника.",-1
44,"НАИБОЛЕЕ ЧАСТОЙ ПРИЧИНОЙ ТРАНЗИТОРНОЙ ИШЕМИИ МИОКАРДА ЯВЛЯЕТСЯ __________ КОРОНАРНОЙ АРТЕРИИ
А врожденная аномалия
Б спазм
В стеноз
Г тромботическая окклюзия",В стеноз ,"Наиболее частой причиной транзиторной ишемии миокарда является спазм коронарной артерии. Правильный ответ - Б. Спазм коронарной артерии вызывает временное сужение просвета сосуда, что приводит к уменьшению кровотока и, как следствие, к ишемии миокарда. Это состояние может быть вызвано различными факторами, включая стресс, холод, курение и некоторые медикаменты.",-1
45,"ОСНОВНЫМ ПАТОГЕНЕТИЧЕСКИМ ФАКТОРОМ ИНФАРКТА МИОКАРДА ЯВЛЯЕТСЯ
А тромбоз коронарной артерии
Б внезапное повышение потребности миокарда в кислороде
В спазм коронарной артерии
Г окклюзия коронарной артерии атеросклеротической бляшкой",А тромбоз коронарной артерии ,"Ответ: А. Тромбоз коронарной артерии.
Обоснование: Инфаркт миокарда развивается вследствие острого несоответствия между потребностью миокарда в кислороде и возможностью коронарного кровотока обеспечить эту потребность. Основной причиной такого несоответствия является окклюзия коронарной артерии, чаще всего вызванная тромбозом. Тромб образуется на повреждённой поверхности атеросклеротической бляшки, что приводит к полной или частичной закупорке просвета сосуда. В результате нарушается кровоснабжение миокарда, что вызывает его ишемию и некроз.",1
46,"ОБЪЕКТОМ ПЕРВИЧНОЙ ПРОФИЛАКТИКИ ЯВЛЯЮТСЯ
А реконвалесценты острых заболеваний
Б жители в трудоспособном возрасте
В больные хроническими заболеваниями
Г все жители территории",Г все жители территории,"Правильный ответ - Г. Все жители территории.
Первичная профилактика направлена на предотвращение возникновения заболеваний и укрепление здоровья всего населения, включая детей, подростков, взрослых и пожилых людей. Она включает в себя меры по улучшению условий жизни, труда, отдыха, питания, а также пропаганду здорового образа жизни и борьбу с вредными привычками.
Реконвалесценты острых заболеваний, жители в трудоспособном возрасте и больные хроническими заболеваниями также могут быть объектами первичной профилактики, но эти категории не охватывают всё население.",1
47,"ЗА РАЗГЛАШЕНИЕ ВРАЧЕБНОЙ ТАЙНЫ ВРАЧ НЕСЁТ ОТВЕТСТВЕННОСТЬ ДИСЦИПЛИНАРНУЮ, АДМИНИСТРАТИВНУЮ, ГРАЖДАНСКО-ПРАВОВУЮ
А процессуальную
Б уголовную
В материальную
Г персональную",Б уголовную,"Б уголовную
Обоснование: Разглашение врачебной тайны может повлечь за собой уголовную ответственность, поскольку это нарушает права пациента на конфиденциальность информации о его здоровье. Уголовная ответственность включает в себя штрафы, лишение права занимать определенные должности, принудительные работы и даже лишение свободы.",1
48,"ГРАЖДАНИН РФ ИМЕЕТ ПРАВО НА СМЕНУ МЕДИЦИНСКОЙ ОРГАНИЗАЦИИ ИЛИ ЛЕЧАЩЕГО ВРАЧА
А не чаще 1 раза в полгода
Б не чаще 1 раза в год
В ежемесячно
Г у гражданина РФ нет такого прав",Б не чаще 1 раза в год ,"Б не чаще 1 раза в год
Обоснование: Согласно предоставленной информации, гражданин РФ имеет право сменить медицинскую организацию или лечащего врача не чаще одного раза в год, за исключением случаев изменения места жительства или места пребывания. Это правило действует как для первичной медико-санитарной помощи, так и для специализированной медицинской помощи.",1
49,"К ТИПУ «А» ПЕРЕРЫВА ДУГИ АОРТЫ ОТНОСЯТ ПЕРЕРЫВ НА УРОВНЕ
А проксимальной части
Б перешейка
В восходящей аорты
Г дистальной части",Б перешейка,"Правильный ответ - Б, перешейка. Это соответствует определению типа А перерыва дуги аорты, который характеризуется отсутствием просвета аорты на уровне перешейка.",1
50,"БОЛЬШИНСТВО БОЛЬНЫХ С КЛАПАННЫМ АОРТАЛЬНЫМ СТЕНОЗОМ УМИРАЕТ
А от инфаркта миокарда
Б от инфекционного эндокардита
В в течение 4-5 лет от момента возникновения порока	
Г в течение 4-5 лет с момента возникновения синкопов, болей в области сердца, одышки и сердечной недостаточности","Г в течение 4-5 лет с момента возникновения синкопов, болей в области сердца, одышки и сердечной недостаточности","Правильный ответ – В. Большинство больных с клапанным аортальным стенозом умирает в течение 4-5 лет от момента возникновения порока. Это связано с тем, что аортальный стеноз – это сужение отверстия аортального клапана, которое приводит к нарушению кровотока из левого желудочка в аорту. Со временем стеноз прогрессирует, что приводит к увеличению нагрузки на левый желудочек и развитию сердечной недостаточности.",-1
51,"ДЛЯ МИТРАЛЬНОГО СТЕНОЗА АУСКУЛЬТАТИВНЫМ ПРИЗНАКОМ НЕ ЯВЛЯЕТСЯ
А диастолический шум с пресистолическим усилением
Б раздвоенный второй тон
В хлопающий первый тон
Г систолический шум",Г систолический шум,"Правильный ответ - Г (систолический шум).
Обоснование: Систолический шум не является характерным признаком митрального стеноза, так как он обычно связан с другими патологиями, такими как пролапс митрального клапана или регургитация через митральный клапан. Митральный стеноз характеризуется специфическими аускультативными признаками, включая “хлопающий” первый тон, раздвоение второго тона над легочной артерией и диастолический шум с пресистолическим усилением. Эти признаки связаны с особенностями гемодинамики и анатомическими изменениями, характерными для митрального стеноза.",1
52,"ПРОТИВОПОКАЗАНИЕМ К НАЗНАЧЕНИЮ СТАТИНОВ ЯВЛЯЕТСЯ
А паренхиматозное заболевание печени в анамнезе
Б повышение печеночных трансаминаз в 1,5 раза
В острый коронарный синдром
Г беременность",Г беременность ,"А паренхиматозное заболевание печени в анамнезе
Обоснование: Статины противопоказаны при активных патологических процессах в печени, так как они могут усугубить состояние печени. Повышение печеночных трансаминаз в 1,5 раза и беременность являются временными ограничениями, которые требуют осторожности и мониторинга, но не абсолютными противопоказаниями. Острый коронарный синдром не является противопоказанием к назначению статинов, так как они могут быть полезны для снижения риска осложнений.",-1
53,"МЕХАНИЗМ ДЕЙСТВИЯ ИНГИБИТОРОВ PCSK9 ЗАКЛЮЧАЕТСЯ В
А усилении активности α-рецептора пролиферации пероксисом
Б подавлении активности фермента диацилглицерол ацилтрансферазы-2
В ингибировании фермента пропротеиновой конвертазы субтилизинкексинового типа 9
Г ингибировании фермента 3-гидрокси-3-метил-глутарил-коэнзим А редуктазы",В ингибировании фермента пропротеиновой конвертазы субтилизинкексинового типа 9,"Правильный ответ - В. Механизм действия ингибиторов PCSK9 заключается в ингибировании фермента пропротеиновой конвертазы субтилизинкексинового типа 9 (PCSK9), что приводит к увеличению количества рецепторов липопротеинов низкой плотности (ЛПНП) на поверхности клеток печени. Это, в свою очередь, способствует более эффективному удалению ЛПНП из крови, снижая уровень холестерина в крови.",1
54,"К МОДИФИЦИРУЕМЫМ ФАКТОРАМ РИСКА АТЕРОСКЛЕРОЗА ОТНОСЯТ
А сахарный диабет, подагру, гипертриглицеридемию
Б возраст, гиподинамию, гипотиреоз
В артериальную гипертензию, гипергликемию, гиперхолестеринемию
Г пол, курение, гипертиреоз","В артериальную гипертензию, гипергликемию, гиперхолестеринемию","Правильный ответ - В. Модифицируемые факторы риска атеросклероза включают артериальную гипертензию, гипергликемию и гиперхолестеринемию. Эти факторы могут быть изменены или скорректированы через изменение образа жизни, лечение сопутствующих заболеваний и применение лекарственных препаратов. Например, контроль артериального давления, уровня глюкозы в крови и холестерина может значительно снизить риск развития атеросклероза.",1
55,"ТАРГЕТНАЯ ТЕРАПИЯ ГИПЕРЛИПИДЕМИЙ С ИСПОЛЬЗОВАНИЕМ МОНОКЛОНАЛЬНЫХ АНТИТЕЛ ИМЕЕТ МЕСТО ПРИ ПРИЕМЕ
А секвестрантов желчных кислот
Б ингибиторов PCSK9
В статинов
Г фибратов",Б ингибиторов PCSK9,"Правильный ответ - Б, ингибиторы PCSK9. Ингибиторы PCSK9 представляют собой новейший класс гиполипидемических препаратов, которые блокируют пропротеиновую конвертазу субтилизин-кексинового типа 9 (PCSK9), тем самым повышая количество рецепторов липопротеинов низкой плотности (ЛНП) на поверхности клеток печени, что способствует более эффективному удалению холестерина из крови. Этот механизм действия делает ингибиторы PCSK9 особенно эффективными в снижении уровня холестерина ЛНП, что является ключевым фактором в лечении гиперлипидемий.",1
56,"ДИАГНОЗ «СКРЫТАЯ АГ» ОПРЕДЕЛЯЕТСЯ УРОВНЯМИ (В ММ.РТ.СТ)
А дневного амбулаторного АД >135/85 и «офисного АД» <140/90
Б эпизодически повышенного «офисного» АД и амбулаторного АД >135/85
В среднесуточного амбулаторного АД <130/80 и повышенного «офисного» АД
Г «офисного» АД >160-170/100 мм рт.ст. и дневного амбулаторного АД >135/85",А дневного амбулаторного АД >135/85 и «офисного АД» <140/90,"Правильный ответ - А. Скрытая АГ определяется как состояние, когда уровни дневного амбулаторного АД превышают 135/85 мм рт. ст., но при этом “офисное” АД остается ниже порога 140/90 мм рт. ст. Это означает, что у человека может наблюдаться повышенное давление вне медицинского учреждения, но при посещении врача показатели АД находятся в пределах нормы.",1
57,"К АССОЦИИРОВАННЫМ СОСТОЯНИЯМ ПРИ АРТЕРИАЛЬНОЙ ГИПЕРТОНИИ ОТНОСЯТ
А ИБС: инфаркт миокарда, стенокардию, коронарную реваскуляризацию
Б микроальбуминурию и соотношение альбумина к креатинину (30-300 мг/г; 3,4-34 мг/ммоль)
В ранние сердечно-сосудистые заболевания в анамнезе
Г скорость каротидно-феморальной пульсовой волны >10 м/сек. и лодыжечно-плечевой индекс <0,9","А ИБС: инфаркт миокарда, стенокардию, коронарную реваскуляризацию","Правильный ответ - А, то есть ИБС: инфаркт миокарда, стенокардия, коронарная реваскуляризация. Это связано с тем, что эти состояния являются наиболее тяжелыми и опасными осложнениями артериальной гипертонии, значительно повышающими риск сердечно-сосудистых катастроф.",1
58,"ГИПЕРТОНИЧЕСКАЯ БОЛЕЗНЬ II СТАДИИ УСТАНАВЛИВАЕТСЯ ПРИ
А изменениях со стороны одного или нескольких «органов-мишеней»
Б наличии факторов риска развития сердечно-сосудистых осложнений и ассоциированных клинических состояний
В отсутствии изменений со стороны одного или нескольких органов-мишеней
Г наличии только факторов риска развития сердечно-сосудистых осложнений",А изменениях со стороны одного или нескольких «органов-мишеней» ,"Правильный ответ - А. Гипертоническая болезнь II стадии устанавливается при изменениях со стороны одного или нескольких «органов-мишеней». Это обосновывается тем, что II стадия гипертонической болезни характеризуется выраженной клинической картиной, включая головные боли, головокружения, иногда приступы стенокардии, отдышку при физических усилиях, снижение работоспособности, нарушения сна. Также на этой стадии выявляются признаки поражения органов-мишеней, такие как гипертрофия левого желудочка, ослабление I тона на верхушке сердца, акцент II тона на аорте, и у части больных на электрокардиограмме отмечаются признаки субэндокардиальной ишемии. Эти изменения указывают на наличие поражений органов-мишеней, что является ключевым критерием для определения II стадии гипертонической болезни.",1
